<?xml version="1.0" encoding="UTF-8"?>
<Classes xmlns:xsi="http://www.w3.org/2001/XMLSchema-instance" xsi:noNamespaceSchemaLocation="C:\Users\Orginal\Downloads\Xml-C-project\Xml-C-project-main\classSchema2.xsd">
	<class>
		<classId>1CS</classId>
		<courseId>1C</courseId>
		<teacherId >1T</teacherId>
		<studentId id="1S">
			<session>
				<date>2022-03-22</date>
				<status>1</status>
			</session>
			<session>
				<date>2022-03-24</date>
				<status>-1</status>
			</session>
			<session>
				<date>2022-03-25</date>
				<status>-1</status>
			</session>
			<session>
				<date>2022-03-26</date>
				<status>-1</status>
			</session>
		</studentId>
		
	</class>
	<class>
		<classId>1CS</classId>
		<courseId>2C</courseId>
		<teacherId >2T</teacherId>
		<studentId id="1S">
			<session>
				<date>2023-04-04</date>
				<status>1</status>
			</session>
			<session>
				<date>2023-04-05</date>
				<status>-1</status>
			</session>
			<session>
				<date>2023-04-06</date>
				<status>-1</status>
			</session>
		</studentId>
		<studentId id="3S">
			<session>
				<date>2023-04-04</date>
				<status>1</status>
			</session>
			<session>
				<date>2023-04-05</date>
				<status>-1</status>
			</session>
			<session>
				<date>2023-04-06</date>
				<status>-1</status>
			</session>
		</studentId>
	</class>
</Classes>
